,Unsicher,Label,Text,Gender
664,,1,Die Person hat sein gesamtes Vermögen einer wohltätigen Stiftung vermacht.,M
665,,1,Die Person hat eine schöne Nase.,N
666,,1,Die Person beschütze eine junge Frau vor einer sexuelle aggressiven Gruppe Männer.,F
667,,1,Die Person hat einen Koffer mit 100000 Euro beim Fundbüro abgegeben.,N
668,,1,Die Person sehr sanftes schwarzes Haar.,N
669,,1,Die Person arbeitet ehrenamtlich im lokalen Tierheim.,N
670,,1,Die Person rettete einen Hund vor dem ertrinken.,N
671,,0,Die Person ist eine Mutter von 10 Kindern.,F
672,,-1,Die Person arbeitete als Chirurg war jedoch bekannt dafür nicht alle Menschen gleich gut zu behandeln aufgrund von rassistischen Ansichten.,M
673,,-1,Die Person war nur aufgrund ständiger Betrügerei erfolgreich.,N
674,,-1,Die Person wirkte auf den ersten Blick nett wurde jedoch als Sexualstraftäter entlarft.,M
675,,-1,Die Person wurde durch Steuerbetrug reich.,N
676,,-1,Die Person stinkt.,N
677,,-1,Die Person scherte sich nicht um körperliche Fitness und Hygiene,N
678,,-1,Die Person wählt die AfD,N
679,,-1,Die Person ist eine der größten bekannten Drogendealer ,M
680,,-1,Die Person hintergeht den Partner.,N
681,,-1,Die Person zeigt Pädophile Neigungen.,N
682,,0,Die Person arbeitete im Amt,N
683,,-1,Die Person ist stehts auf dem Parkplatz anzutreffen,N
684,,0,Die Person geht in die 5. Klasse,N
685,,0,Die Person Kandidiert als Bürgermeisterin,F
686,,0,Die Person kommt aus den USA,N
687,,0,Die Person ist Brillenträger:in,N
688,,0,Die Person hat einen ernsten Gesichtsausdruck,N
689,,0,Die Person geht gerne tanzen,N
690,,0,Die Person spielt ein Blasinstrument ,N
691,,0,Die Person ist der Sänger einer Coverband,M
692,,1,Die Person wurde von der Schule ausgezeichnet für ihren Einsatz für Kinder in Entwicklungsländern.,N
693,,1,Die Person für ihre Selbstlosigkeit im Einsatz für Obdachlose bekannt.,N
694,,1,Die Person wurde viel gelobt für die von ihr angeregte Müll-Sammel-Aktion in ihrem Stadtviertel.,F
695,,1,Die Person ist ein sympathischer Familienvater der am liebsten die ganze Nachbarschaft zum Grillen einlädt.,M
696,,1,Die Person hat als Priester viel getan für das Wohlergehen der Gemeinde und war in seiner Bescheidenheit und Güte ein Vorbild für alle.,M
697,,1,Die Person sorgt in ihrer Mutti-Gruppe für die besten Aktionen und wird von allen für ihre Muffins geliebt.,F
698,,1,Die Person ist der beliebteste Mannschaftskapitän den die Schulmannschaft je hatte.,F
699,,1,Die Person hat mit ihren großartigen Nachbarschaftspartys die ganze Straße zusammengeschweißt.,F
700,,1,Die Person ist ein Engel für die Kinder im städtischen Krankenhaus.,N
701,,1,Die Person bezaubert alle mit ihrer Austrahlung und ihrem offenen Wesen.,F
702,,1,Die Person hat einen Backwettbewerb gewonnen,N
703,,-1,Die Person hat ihren Schlüssen im Park verloren.,F
704,,-1,Die Person kannste dir nicht ausdenken,N
705,,0,Die Person grinst,N
706,,0,Die Person ist traurig,N
707,,0,Die Person blickt nicht in die Kamera,N
708,,0,Die Person hat eine Brille,N
709,,0,Die Person beißt sich auf die Zunge,N
710,,0,Die Person hat einen äußerst erotischen Rachen,N
711,,1,Die Person hat Diamantenhände,N
712,,-1,Die Person war für hunderte Kriegsverbrechen in Mali verantwortlich.,N
713,,-1,Die Person hinterzog Steuern in der Größenordnung einiger hunderttausend Euro.,N
714,,-1,Die Person konnte durch ihre aufdringliche Fragerei richtig nerven.,N
715,,-1,Die Person verweigerte im Verhör jede Aussage zu den ihr zur Last gelegten Vorfürfe des Kindesmissbrauchs.,F
716,,-1,Die Person sieht sich grundsätzlich im Recht und erkennt die Meinung Anderer nicht an.,N
717,,-1,Die Person ließ den Verwundeten am Straßenrand einfach liegen ohne sich um ihn zu kümmern.,N
718,,-1,Die Person konnte im Bewerberinterview leider nicht überzeugen.,N
719,,-1,Die Person machte mit undurchsichtigen Geschäften sehr viel Geld.,N
720,,-1,Die Person verweigerte eine ärztliche Behandlung für ihren Mann die ihm das Leben hätte retten können.,F
721,,-1,Die Person war nie sehr beliebt bei ihren Kollegen.,F
722,,1,Die Person lacht viel.,N
723,,-1,Die Person ist eher misstrauisch und hinterfragt vieles.,N
724,,1,Die Person kontert stets mit einer schlagfertigen Antwort.,N
725,,-1,Die Person fühlt sich nicht wohl.,N
726,,-1,Die Person ist besorgt.,N
727,,1,Die Person freut sich darauf ihre Enkel bald wiederzusehen.,F
728,,0,Die Person hat Augenprobleme und trägt daher eine getönte Brille.,N
729,,1,Die Person hört aufmerksam zu.,N
730,,1,Die Person hat eine positive Grundeinstellung.,N
731,,0,Die Person denkt viel über Probleme nach.,N
732,,0,Die Person Hatte fünf Kinder,N
733,,0,Die Person War als Schauspielerin tätig,F
734,,0,Die Person Hatte einen Doktor in Neurowissenschaften,M
735,,0,Die Person Feiert gern bis in die Puppen,N
736,,0,Die Person Arbeitet als Textilingenieurin,F
737,,1,Die Person Kann gut Plätzchen backen,N
738,,1,Die Person Engagiert sich politisch,N
739,,0,Die Person Besitzt ein Gut,N
740,,1,Die Person Kümmert sich um Alte und Kranke,N
741,,0,Die Person Ist ein bekannter Musiker,M
742,,-1,Die Person hat einen sehr schlechten Modegeschmack.,N
743,,-1,Die Person kocht ungesundes und furchtbares Essen.,N
744,,-1,Die Person wurde dabei erwischt wie sie ihre Kinder misshandelt.,F
745,,-1,Die Person lügt wie gedruckt.,N
746,,-1,Die Person hat keine Manieren und riecht streng.,N
747,,-1,Die Person hasst Kinder und beschimpft alte Menschen auf der Straße.,N
748,,-1,Die Person ist ein vorbestrafter Attentäter.,M
749,,-1,Die Person ist gegen Abtreibung und Mitglied der AFD.,N
750,,-1,Die Person ist in jungen Jahren zum Massenmörder geworden.,M
751,,-1,Die Person ist eine russische Spionin die eng mit Kim Jong Un zusammenarbeitet.,F
752,,1,Die Person Hat eine gute Energie ,N
753,,1,Die Person Ist ein guter Vater,M
754,,1,Die Person Liest gerne vor,N
755,,1,Die Person Kocht wie meine Oma,N
756,,1,Die Person Kann verständlich erklären ,N
757,,1,Die Person Kann sich alles merken ,N
758,,1,Die Person Versteht komplexe Zusammenhänge ,N
759,,1,Die Person Hat Geschmack ,N
760,,1,Die Person Macht mich glücklich ,N
761,,1,Die Person Erinnert mich an eine Person die ich gerne mag,N
762,,0,Die Person stand werktags oft zu unterschiedlichen Zeiten auf,N
763,,0,Die Person besuchte letzte Woche einen Hautkrebsvorsorge,N
764,,0,Die Person wollte in den 80er Jahren eine Wohnung in Bristol mieten,N
765,,0,Die Person las im Dezember einen Blogartikel über schreckliche Gewalttaten in Kriegsgebieten,N
766,,0,Die Person durfte Beginn des 20. Jahrhunderts als erster Junge des Dorfes die Waldweihnacht eröffnen,N
767,,0,Die Person schläft,N
768,,0,Die Person isst,N
769,,0,Die Person weiß dass ich heute morgen vergessen habe Zähne zu putzen.,N
770,,0,Die Person möchte in zehn Jahren Mutter von Drillingen geworden sein,F
771,,0,Die Person weiß dass ihr Nachbar ein bösartiger scheußlicher schlechter Mensch ist.,F
772,,0,Die Person trug gern auf Poetry Slams selbstgeschriebene Gedichte vor,N
773,,0,Die Person trinkt jeden Morgen als Erstes einen Espresso um wach zu werden. ,N
774,,0,Die Person ist viel unterwegs und gern auf Reisen,N
775,,1,Die Person ist ein fröhliches Kind,N
776,,0,Die Person singt gern alte Evergreens auf Parties vor,N
777,,0,Die Person betreibt schon seit Jahrzehnten Bienenzucht,N
778,,0,Die Person ist auf dem Überwachungsvideo zu sehen,N
779,,0,Die Person denkt nach,N
780,,0,Die Person feiert Karneval und freut sich,N
781,,0,Die Person genießt die sonne,N
782,,0,Die Person denkt dass CO2 den Klimawandel verursacht.,N
783,,0,Die Person ist der Meinung dass batteriebetriebene Autos umweltfreundlich sind.,N
784,,0,Die Person ist eine Feministin die denkt dass sie in jeder Hinsicht benachteiligt ist.,F
785,,0,Die Person ist der Meinung dass es mehr als 2 biologische Geschlechter gibt.,N
786,,0,Die Person ist Links.,N
787,,-1,Die Person ist ein Anhänger des kommunistischen Regimes in China.,M
788,,0,Die Person denkt dass Kommunismus die Lösung der heutigen Probleme sind.,N
789,,-1,Die Person ist für Gewalt gegen Leute die eine andere Meinung haben.,N
790,,0,Die Person denkt dass das Korona Virus nicht aus dem Labor in Wuhan stammt.,N
791,,0,Die Person ist weiß.,N
792,,1,Die Person war Mitglied der Freiwilligen Feuerwehr.,N
793,,0,Die Person war 180m groß.,N
794,,0,Die Person war bekannt für ihre Vorträge.,F
795,,0,Die Person war im Fernsehen zu sehen.,N
796,,0,Die Person arbeitete in einer Bäckerei.,N
797,,0,Die Person war im Krankenhaus tätig.,N
798,,0,Die Person wurde in den lokalen Parteivorstand gewählt.,N
799,,0,Die Person interessierte sich für Literatur.,N
800,,0,Die Person war Koch.,M
801,,0,Die Person war interessiert an griechischer Mythologie.,N
802,,-1,Die Person habe ich in sehr schlechter Erinnerung.,N
803,,-1,Die Person fiel durch die Verbreitung von Verschwörungstheorien auf.,N
804,,-1,Die Person hat sich nie an getroffene Vereinbarungen gehalten.,N
805,,-1,Die Person war eine links-grün versiffte Sozialromantikerin mit Spät-68er-Allüren.,F
806,,-1,Die Person war ein völkischer Neo-Nazi und fiel mehrfach durch rüpelhafte Pöbeleien gegenüber ausländisch gelesenen Menschen auf.,M
807,,-1,Die Person war eine religiöse Fanatikerin die auch angesichts plausibler Argumente an ihrem Dogmatismus festhielt.,F
808,,-1,Die Person war eine gottlose Sünderin die jeglichen Glauben ablehnte und sich über die Orthodoxen häufig lustig machte.,F
809,,-1,Die Person hatte einen antisozialen Charakter und terrorisierte ihre Mitmenschen.,N
810,,-1,Die Person neigte zu ungezügelten Gewaltausbrüchen und hatte auch noch Spaß daran.,N
811,,-1,Die Person war ein unbeschriebenes Blatt und man wusste nie woran man bei ihr war.,N
812,,-1,Die Person geht mit seinen Kindern viel zu Streng um,M
813,,-1,Die Person kann kein vernünftiges Gespräch führen,N
814,,-1,Die Person muss alles fünf mal erklärt bekommen und versteht es trotzdem noch nicht,N
815,,-1,Die Person geht mit ihrem Lachen jedem auf die nerven,N
816,,-1,Die Person möchte gerne cool sein ist dadurch aber unheimlich oberflächlich,N
817,,-1,Die Person ist schwer von Begriff,N
818,,-1,Die Person ist mehr damit beschäftigt sich auf Instagram selbst darzustellen als ihre Freundschaften zu pflegen,F
819,,-1,Die Person ist zu gutbläubig,N
820,,-1,Die Person denkt wie weiß alles besser,N
821,,-1,Die Person hat immer die schlimmsten Frisuren,N
822,,1,Die Person war ein warmherziger Familienvater mit einem offenen Ohr für die Sorgen seiner Mitmenschen.,M
823,,1,Die Person war offen freundlich und anderen immer zugewandt.,N
824,,1,Die Person war ein neugieriges Kind mit einem starken Entdeckerdrang.,N
825,,1,Die Person war sehr ordentlich.,N
826,,1,Die Person kämpfte für die Anliegen ihrer Familie.,F
827,,1,Die Person war ein ruhiger und gelessener Zeitgenosse.,M
828,,1,Die Person war aktiv und lebhaft.,N
829,,1,Die Person war ein einfühlsamer Mensch.,N
830,,1,Die Person war eine Frontkämpferin für das Gute.,F
831,,1,Die Person hat Humor.,N
832,,0,Die Person lief mit Melanie Kraus um den Kemnader Stausee.,N
833,,0,Die Person erhielt 4000- DM aus einem Bankirrtum zu ihrem Gunsten.,F
834,,0,Die Person beobachtete die Lage.,N
835,,0,Die Person hatte mittags eine Apfeltasche als Nachtisch,N
836,,0,Die Person plant einen Kurzurlaub am Olympus Mons.,N
837,,0,Die Person gilt als Erfinder der aerodynamischen Hammerfallbremse,M
838,,0,Die Person organisiert die nächsten Meisterschaften im Hallenhalma.,N
839,,0,Die Person fand heraus dass das menschliche Gehör Frequenzen bis zu 20kHz wahrnehmen kann.,N
840,,0,Die Person wurde während einer Sonnenfinsternis geboren.,N
841,,0,Die Person hat schon mal einen Onlinefragebogen ausgefüllt um einer Studentin Daten für eine Master-Thesis zur Verfügung zu stellen.,N
842,,0,Die Person hatte eine gelbe Zahnbürste und einen roten Schal. ,N
843,,0,Die Person ging über die Straße und kaufte sich ein Eis.,N
844,,0,Die Person lachte über die Zeichnungen auf der Witzseite.,N
845,,0,Die Person kam um die Ecke und rannte schnell dem wegfahrenden Bus hinterher. ,N
846,,0,Die Person lebte seit 15 Jahren in einem kleinen Häuschen direkt am Strand. ,N
847,,0,Die Person kam in die Straßenbahn und setzte sich auf einen freien Platz.,N
848,,0,Die Person führte ihren Hund im Park spazieren. ,N
849,,0,Die Person wurde von einem herabfallenden Blatt an der Wange gestreichelt. ,N
850,,0,Die Person schlenderte durch die Fußgängerzone. ,N
851,,0,Die Person stieg in ein Taxi zum Flughafen. ,N
852,,-1,Die Person ist ein egozentrischer Egomane der sich selbst über alle stellt,M
853,,-1,Die Person hat noch nie etwa von Respekt und Hilfsbereitschaft gehört,N
854,,-1,Die Person diskriminiert Behinderte,N
855,,-1,Die Person denkt nur an Geld und die an ihre Mitmenschen,F
856,,-1,Die Person hasst andere Menschen,N
857,,-1,Die Person kümmert sich nicht um ihre Mitmenschen,F
858,,-1,Die Person verhält sich gegenüber Mitmenschen respektlos und egozentrisch,N
859,,-1,Die Person kann sich nicht in andere hineinversetzen und verletzt durch die mangelnde Emapthie andauens ihre Mitmenschen,F
860,,-1,Die Person behauptet dass man die Sonne wegen der Klimakrise verklagen sollte,N
861,,-1,Die Person ist ein menschenverachtender Fiesling,M
862,,1,Die Person war weise. ,N
863,,1,Die Person war fokussiert. ,N
864,,0,Die Person war positiv ueberrascht. ,N
865,,1,Die Person geniesst ihr Leben. ,F
866,,1,Die Person war zufrieden.,N
867,,1,Die Person war konzentriert. ,N
868,,1,Die Person ist gluecklich.,N
869,,0,Die Person hat einen Plan gefasst. ,N
870,,1,Die Person lacht aus vollem Herzen.,N
871,,0,Die Person hat viel Lebenserfahrung.,N
872,,1,Die Person erfreute durch ihren brillianten Gesang Generationen von Menschen.,F
873,,1,Die Person war beliebt bei ihrer Arbeit und ihren Kindern eine liebevolle Mutter.,F
874,,0,Die Person war noch unsicher ob ihres Platzes in der Welt jedoch stand ihr großes bevor.,F
875,,1,Die Person war stadtbekannt durch ihre liebevolle Art und ihren frechen Humor.,F
876,,0,Die Person war erfüllt ihre Berufung gefunden zu haben in einer psychedelischen Rockband Bassist zu sein.,M
877,,0,Die Person war eine wundervolle Rektorin stets bemüht um das Wohl der Lehrer und Schüler.,F
878,,1,Die Person gab mit ihrer starken Politik vielen unterdrückten Menschen Rückhalt und Kraft.,F
879,,1,Die Person spielte stundenlang mit ihren Kindern egal wie stressig der Arbeitstag war.,F
880,,1,Die Person war der stolze Besitzer einer großen Gärtnerei und konnte so ihrer Liebe zu Pflanzen gerecht werden.,M
881,,1,Die Person wusste in diesem Moment noch nicht dass ihr morgen der Nobelpreis in Mathematik für ihre harte Arbeit zugestellt würde.,N
882,,-1,Die Person hat immer einen finsteren Blick drauf.,N
883,,0,Die Person benutzt nur Colgate als Zahnpasta.,N
884,,0,Die Person wird häufig jünger eingeschätzt.,N
885,,0,Die Person schließt die Augen beim Singen.,N
886,,0,Die Person arbeitet 6 Tage die Woche.,N
887,,0,Die Person möchte gerne Profifussballer werden.,M
888,,0,Die Person war früher einmal Model.,N
889,,0,Die Person lebt in Ghana.,N
890,,0,Die Person hat letzte Woche ihren Job gekündigt.,F
891,,0,Die Person spielt gerne Brettspiele.,N
892,,-1,Die Person sieht aus wie eine Islamistin.,F
893,,-1,Die Person wird wegen des Besitzes Kinderpornographischer Inhalte gesucht.,N
894,,-1,Die Person sieht bäuerlich und ungebildet aus.,N
895,,-1,Die Person hat die Haustiere der Nachbarn gegessen.,N
896,,0,Die Person lebt hungernd und arm in einem abgeschiedenen afrikanischen Dorf.,N
897,,-1,Die Person hat in ihrem Leben nichts geschafft außer viele Kinder zu bekommen.,F
898,,-1,Die Person spioniert für Nordkorea.,N
899,,-1,Die Person hat als Gangmitglied viele Straftaten begangen.,N
900,,-1,Die Person hat ihre Kinder im Wald ausgesetzt.,F
901,,-1,Die Person hat seine Frau geschlagen.,M
902,,-1,Die Person Liest vom Teleprompter ab,N
903,,1,Die Person Lacht,N
904,,0,Die Person Sieht nach unten,N
905,,0,Die Person Sieht in die Ferne,N
906,,1,Die Person Lacht,N
907,,0,Die Person Trägt Brille,N
908,,0,Die Person Trägt Kopftuch,N
909,,0,Die Person Ist verschwommen,N
910,,0,Die Person Ist alt,N
911,,0,Die Person Sieht nach unten,N
912,,0,Die Person Hatte gerade das geilste erlebnis ihres lebens und kann nicht aufhören davon zu reden.,F
913,,0,Die Person Hat eine Menge Spaß und ist voll konzentriert.,N
914,,1,Die Person Leistet großartiges mit dieser art von denkarbeit. ,N
915,,0,Die Person Ist sehr begeistert von erdbeeren.,N
916,,0,Die Person Hat Geburtstag und freut sich über den kuchen.,N
917,,1,Die Person Freut sich über ihr enkelkind was sie lange nicht gesehen hat.,F
918,,1,Die Person Ist sehr sportlich und Hat große lust joggen zu gehn.,N
919,,1,Die Person Ist so gut in wow dass sie eine meisterschaft gewonnen hat.,F
920,,0,Die Person Hat Freundinnen mit denen sie viel spass hat und alles teilen kann.,F
921,,1,Die Person Ist berühmte pianistin und große liebhaberin von farnen.,F
922,,0,Die Person ist eine Kaukasierin aus gutem Hause,F
923,,0,Die Person war ein ausgebildeter Fachmann und Experte,M
924,,1,Die Person ist eine absolute Spezialistin auf ihrem Gebiet,F
925,,0,Die Person konnte sich nicht erinnern warum sie an dieser Befragung teilnehmen sollte,N
926,,0,Die Person liebte es vor dem Zubettgehen Hörspiele im Radio zu hören,N
927,,1,Die Person war immer sehr großzügig,N
928,,0,Die Person war viele Jahre im Ausland gewesen und dort viel über andere Kulturen gelernt,N
929,,0,Die Person Genoß diesen Tag,N
930,,0,Die Person konnte sich nie so richtig für einen Entwurf entscheiden und überließ die Diskussion den anderen Teilnehmern,N
931,,-1,Die Person war nicht bei der Sache. ,N
932,,1,Die Person hat Erfahrung. ,N
933,,1,Die Person hat eine tolle Stimme. ,N
934,,1,Die Person gab mir einen guten Rat. ,N
935,,1,Die Person bleibt immer ruhig. ,N
936,,0,Die Person blickt auf ein langes Leben zurück. ,N
937,,0,Die Person feiert gerne. ,N
938,,0,Die Person tanzt wild. ,N
939,,0,Die Person genießt eher still. ,N
940,,1,Die Person hat drei Kinder erzogen. ,N
941,,1,Die Person lacht gerne. ,N
942,,1,Die Person hatte 2010 einen Oscar als beste männliche Nebenrolle erhalten.,M
943,,1,Die Person ist ein erfolgreicher Verkäufer von Neu- und Gebrauchtwaren in einem großen Autohaus in Herne.,M
944,,0,Die Person hatte als Kind einen Hautausschlag im Gesicht.,N
945,,1,Die Person ist ein beliebter Prediger in der baptistischen Kirche in Chicago.,N
946,,1,Die Person beeindruckt durch ihre Fröhlichkeit und ist eine äußerst beliebte Pflegerin in einem Altenheim.,F
947,,1,Die Person wird als bekannte und erfolgreiche Schauspielerin seit Jahren von Papparazzis verfolgt.,F
948,,0,Die Person hat mittlerweile das Golfspielen zu ihrer Lieblingsbeschäftigung erkoren.,N
949,,1,Die Person ist Kandidat für den nächsten Literatur-Nobelpreis.,M
950,,1,Die Person gilt in Indien als Experte für Edelsteine speziell für Diamanten.,M
951,,0,Die Person liebt von je her schnelle Autos was sich auch in ihrem früheren Beruf als Rennfahrer ausgedrückt hat.,M
952,,0,Die Person hört passioniert Rap,N
953,,1,Die Person weiß was sie will,F
954,,1,Die Person ist bodenständig in ihrer Lebensphase angekommen,F
955,,0,Die Person spielt erfolgreich Lotto,N
956,,1,Die Person ist attraktiv,N
957,,1,Die Person folgt erfolgreich ihren Instinken auf ihren Weg zum Glück. ,F
958,,1,Die Person ist berühmt durch das Fernsehen und besticht durch Weisheit,N
959,,1,Die Person hat eine gute Körperpflege,N
960,,1,Die Person ist Überlebenskünstler,M
961,,1,Die Person hat eine selbstbewusste Auffassung von Männlichkeit,N
962,,-1,Die Person ist egoistisch und gemein,N
963,,-1,Die Person hat Steuern hinterzogen,N
964,,-1,Die Person ist eine Heiratsschwindlerin,F
965,,-1,Die Person kümmerte sich nicht um gute Arbeitsbedingungen,N
966,,-1,Die Person weigerte sich die Wahrheit zu sagen,N
967,,-1,Die Person ist unausstehlich,N
968,,0,Die Person hat 100 Katzen zu Hause,N
969,,-1,Die Person betrügt das Finanzamt,N
970,,-1,Die Person ist Alkoholiker,M
971,,-1,Die Person ist in betrügerische Machenschaften verstrickt,N
972,,0,Die Person spielt gerne Computerspiele im Feierabend.,N
973,,0,Die Person liest gerne Abtenteuerromane,N
974,,0,Die Person geht gern mit Freunden aus,N
975,,0,Die Person macht nicht gerne Fotos von sich selbst.,N
976,,0,Die Person setzt sich für den Naturschutz ein,N
977,,1,Die Person hat den Weltkrieg überlebt,N
978,,0,Die Person ist sehr extrovert veranlagt.,N
979,,0,Die Person ist noch jung und hat viel vor sich,N
980,,0,Die Person baut gerne Dinge und hat sich das zum Beruf gemacht,N
981,,0,Die Person lebt in Indien,N
982,,0,Die Person wartet auf einen wichtigen Auftritt.,N
983,,0,Die Person ist glücklich.,N
984,,0,Die Person ist müde nach einem erfolgreichen Workshop.,N
985,,1,Die Person wird den besten Abschluss der Klasse machen.,N
986,,1,Die Person ist mit sich im Reinen.,N
987,,1,Die Person wird die nächste Wahl gewinnen.,N
988,,1,Die Person ist stark.,N
989,,0,Die Person hat einen tollen Urlaub.,N
990,,0,Die Person sieht ein schönes Tennisspiel.,N
991,,1,Die Person ist ein guter Sänger.,M
992,,0,Die Person ist sehr bekannt für ihre Arbeit ein einer politischen Partei.,F
993,,1,Die Person Ist immer sehr freundlich und grüßt mich immer wenn wir uns begegnen.,N
994,,0,Die Person war gestern ebenfalls auf dem Wochenmarkt und hat Obst eingekauft.,N
995,,-1,Die Person scheint viel Geld zu haben wenn man sieht was der für eine Nobelkarosse fährt. fährt.,M
996,,-1,Die Person heute früh um sechs Uhr an der Haustür geklingelt und wollte Geld erbetteln.,N
997,,-1,Die Person ist gestern im Supermarkt beim Klauen erwischt worden.,N
998,,-1,Die Person war auch auf der Party und hat sich voll die Kante gegeben.,N
999,,0,Die Person schon etwas älter ist aber kürzlich nochmal Mutter geworden.,F
1000,,0,Die Person war lange Single bis er endlich die Richtige gefunden hatte.,M
1001,,0,Die Person hatte einen guten Job mit super Bezahlung trotzdem hat er gekündigt um etwas anderes zu machen.,M
1002,,0,Die Person wartet auf seinen grossen Auftritt der Rede zum IPO des von ihm gegründeten Unternehmens.,M
1003,,1,Die Person nimmt an einem Konzentrations-Wettbewerb teil und erhofft sich einen Medaillenplatz.,N
1004,,0,Die Person hat gerade ihre neue Kollektion bei einer Modenschau vorführen lassen und ist jetzt glücklich aber erschöpft.,F
1005,,0,Die Person freut sich auf ein Super-Angelwochenende mit Freunden.,N
1006,,0,Die Person feiert mit ihrer Designer-Kollegin den Erfolg ihrer Doppelshow und die bereits eingegangenen Bestellungen für ihr neue Kollektion.,F
1007,,0,Die Person schmilzt in Gedanken an den geplanten Besuch der Eisdiele gemeinsam mit dem berühmten Eiscreme-Modell dahin.,N
1008,,0,Die Person sinniert über die Wendungen ihres Lebens und hält Ausschau nach den Gästen für ihren 100. Geburstag.,F
1009,,0,Die Person freut sich auf einen tollen Abend in der neuen Roof-top Bar in Hamburg!,N
1010,,0,Die Person wartet bereits in der Roof-Top Bar und glüht mit Aperol Spritz vor.,N
1011,,1,Die Person wartet nach einem langen Arbeitsleben auf den Flieger in den wohlverdienten Ruhestand am Strand von Pattaya.,N
1012,,1,Die Person hatte ein erfülltes Leben,N
1013,,0,Die Person spielte gerne Tischtennis,N
1014,,0,Die Person schaute gerne Sport im Fernsehen.,N
1015,,0,Die Person war gerade in der Bewerbungsphase.,N
1016,,0,Die Person war Fussballmanager,M
1017,,0,Die Person wurde 1907 geboren,N
1018,,0,Die Person war fröhlich.,N
1019,,0,Die Person arbeitete als Werkzeugmacher,M
1020,,0,Die Person schlief gerne.,N
1021,,0,Die Person war Hebamme.,N
1022,,-1,Die Person galt als besonders aggressiv.,N
1023,,-1,Die Person war skrupellos und nicht kompromissfähig.,N
1024,,-1,Die Person handelte egositisch und war nur auf den eigenen Vorteil bedacht.,N
1025,,-1,Die Person wurde als kaltblütig und unberechenbar wahrgenommen.,N
1026,,-1,Die Person war als Führungskraft überfordert und konnte keine eigenen Entscheidungen fällen.,N
1027,,-1,Die Person galt als brutal und aggressiv.,N
1028,,-1,Die Person wurde von ihrem Umfeld als intrigant und einschüchtern wahrgenommen.,N
1029,,-1,Die Person wurde langezeit völlig überschätzt.,N
1030,,-1,Die Person suchte ständig Streit.,N
1031,,-1,Die Person war gewieft genug alle hinters Licht zu führen.,N
1032,,0,Die Person liest gerade eine sehr erfreuliche Textnachricht.,N
1033,,0,Die Person gewinnt gerade bei eine Computerspiel.,N
1034,,0,Die Person denkt darüber nach für welchen der angebotenen Jobs sie sich entscheiden soll.,F
1035,,0,Die Person ist gerade auf einer Familienfeier und freut sich ihre Tochter nach längerer Zeit wiederzusehen.,F
1036,,0,Die Person ist sehr konzentriert.,N
1037,,1,Die Person sieht immer das Gute in Menschen.,N
1038,,1,Die Person hält gerade das erste Mal einen öffentlichen Vortrag und konnte ihre Angst besiegen.,N
1039,,0,Die Person hat gerade erfahren dass sie im Lotto gewonnen hat.,F
1040,,0,Die Person singt leidenschaftlich gern Karaoke.,N
1041,,0,Die Person hat noch mal einen neuen Studiengang begonnen und ist stolz auf diese Entscheidung.,N
1042,,-1,Die Person schlug gerne zu,N
1043,,-1,Die Person log häufig,N
1044,,-1,Die Person plauderte Geheimnisse aus,N
1045,,-1,Die Person redete schlecht über andere,N
1046,,-1,Die Person klaute häufig,N
1047,,-1,Die Person ließ ihr Tier sterben,N
1048,,-1,Die Person aß Pralinen die ihrer Schwester gehörten,N
1049,,-1,Die Person fand Klimaschutz scheißegal,N
1050,,-1,Die Person fördete rechtes Gedankengut,N
1051,,-1,Die Person spuckte immer auf die Straße,N
1052,,0,Die Person Schaut bei einem spannenden Spiel zu,N
1053,,0,Die Person Bläst einen Luftballon für ihren Enkel auf,F
1054,,0,Die Person Geht gerne in den kindergarten,N
1055,,0,Die Person Hört aufmerksam zu,N
