,Unsicher,Label,Text,Gender
1056,,0,Die Person Wartet auf den Anfang des theaterstpcks,N
1057,,0,Die Person Singt vor interessiertem Publikum,N
1058,,0,Die Person Erzählt ihren Kindern eine Geschichte zum einschlafen,F
1059,,0,Die Person Freut sich im Zoo an den eisbären,N
1060,,0,Die Person Lacht über ihre enkel,F
1061,,1,Die Person Überlegt wie die jemand anderem helfen kann,N
1062,,1,Die Person hat ihr Studium gerade erfolgreich beendet,N
1063,,0,Die Person korrigiert gerade einen Programmcode,N
1064,,0,Die Person sieht seinem Enkel beim spielen zu,M
1065,,0,Die Person hat im Lotto gewonnen,N
1066,,0,Die Person sieht sein neues Auto,M
1067,,0,Die Person sieht seiner Frau zu wie sie ihm seinen geburtstagskuchen bringt,M
1068,,0,Die Person hat gleich Bibelstunde,N
1069,,0,Die Person unterrichtet und hört seinen Studenten bei einem Vortrag zu,M
1070,,0,Die Person hält ihren ersten Vortrag,F
1071,,0,Die Person sieht sein erstes gehalt auf dem Konto,M
1072,,-1,Die Person roch meist unangenehm nach indischem Essen.,N
1073,,-1,Die Person wurde von allen als sehr unheimlich wahrgenommen.,N
1074,,-1,Die Person ließ sich nicht gerne fotografieren und ruinierte damit jedes Bild.,N
1075,,-1,Die Person sah immer sehr griesgrämig und verbittert aus.,N
1076,,-1,Die Person war dafür bekannt sehr schlechte Zähne zu haben.,N
1077,,-1,Die Person war so furchtbar schüchtern dass man ihr kein Wort entlocken konnte.,N
1078,,-1,Die Person wollte sich einfach nicht eingestehen dass sie kein Talent hat als Basketballspieler.,F
1079,,-1,Die Person konnte einfach nicht leise sein und nervte damit ihre Mitmenschen.,F
1080,,-1,Die Person war absolut ungeeignet als Fotomodel.,N
1081,,-1,Die Person war immer so schlecht gelaunt dass niemand mit ihr zusammenarbeiten wollte.,F
1082,,0,Die Person ist verschwommen zu sehen,N
1083,,0,Die Person schaut gerade aus,N
1084,,0,Die Person ist von der Seite zu sehen,N
1085,,0,Die Person schaut nach unten,N
1086,,0,Die Person ist nicht zu erkennen,N
1087,,0,Die Person trinkt ,N
1088,,0,Die Person hat eine Brille,N
1089,,0,Die Person hat die Augen zu,N
1090,,0,Die Person schaut mich an,N
1091,,0,Die Person schaut nach unten,N
1092,,1,Die Person singt seit drei Jahren leidenschaftlich und mit großem Erfolg in einem Chor,N
1093,,1,Die Person kocht ausgezeichnet und liebt es Gäste zu bewirten,N
1094,,-1,Die Person hustete Leute an als er Corona hatte. ,M
1095,,-1,Die Person freute sich als der alte Mann stürzte. ,N
1096,,-1,Die Person freute sich als der Zoo geschlossen wurde. ,N
1097,,-1,Die Person war gegen Impfungen.,N
1098,,-1,Die Person leitete eine Bank die pleite ging und ihre Kunden nicht vor dem Ruin schützen konnte.,N
1099,,-1,Die Person war einfach langweilig.,N
1100,,-1,Die Person verstand keinen Spaß.,N
1101,,-1,Die Person lacht über Arbeitslose.,N
1102,,-1,Die Person lacht an manchen Tagen nicht. ,N
1103,,0,Die Person möchte heute mit niemandem reden.,N
1104,,1,Die Person ist nett,N
1105,,1,Die Person arbeitet hart,N
1106,,0,Die Person mag Haustiere,N
1107,,1,Die Person ist gebildet,N
1108,,-1,Die Person war herablassend,N
1109,,0,Die Person Lächelt in die Kamera,N
1110,,0,Die Person War verwirrt,N
1111,,0,Die Person Spielte über eine peinliche Situationen hinweg,N
1112,,-1,Die Person Konnte nicht glauben dass das Hotel kein Restaurant beinhaltet ,N
1113,,-1,Die Person Musste dringend weg und wurde langsam ungeduldig,N
1114,,-1,Die Person War genervt,N
1115,,0,Die Person Sah einen Freund mit der sie gestritten hatteseit langem zum ersten Mal.,N
1116,,0,Die Person War nicht erfreut dass der Bus ausfiel,N
1117,,0,Die Person Wurde fotografiert ohne vorherige Zustimmung,N
1118,,1,Die Person bewahrte mich vor einem tristen Leben indem ihr Heiterkeit mich tagtäglich von neuem begeisterte.,F
1119,,1,Die Person war mir in schweren Zeiten ein Fels in der Brandung.,N
1120,,1,Die Person ist eine Frohnatur.,N
1121,,1,Die Person brachte mich stets zum Lachen.,N
1122,,1,Die Person ist immer ein willkommener Gast für gesellige Runden.,M
1123,,1,Die Person braucht durch ihr außerordentlich ausgeprägtes Durchhaltevermögen.,F
1124,,1,Die Person ließ mich stets ruhig schlafen.,N
1125,,1,Die Person bringt eine humorvolle Art in jede Gruppe mit ein in der sie auftaucht.,F
1126,,1,Die Person hat ein bezauberndes Lächeln.,N
1127,,1,Die Person versteht es mit ihrem Sachverstand die Welt zu erklären.,N
1128,,0,Die Person denkt über das Leben,N
1129,,0,Die Person Spielt,N
1130,,0,Die Person Überlegt die nächste Strategie,N
1131,,0,Die Person Wartet,N
1132,,0,Die Person Macht den Vortrag,N
1133,,0,Die Person Macht etwas,N
1134,,0,Die Person Ist ein Vater,M
1135,,0,Die Person Liebt ein öffentliches Leben,N
1136,,0,Die Person Hat einen enormen Einfluss,N
1137,,0,Die Person Überlegt,N
1138,,0,Die Person blickt lächelnd nach unten,N
1139,,0,Die Person ist im Profil fotografiert worden,N
1140,,0,Die Person wird von der Sonne angestrahlt,N
1141,,0,Die Person lacht verschmitzt,N
1142,,0,Die Person liest ein Buch,N
1143,,0,Die Person genießt einen Espresso,N
1144,,0,Die Person wurde nicht scharf getroffen,N
1145,,0,Die Person singt oder spricht angeregt,N
1146,,0,Die Person blickt konzentriert,N
1147,,0,Die Person blickt fokussiert in die Kamera,N
1148,,1,Die Person Ist sehr traurig angesichts der Erfahrungen mit der Armut.,N
1149,,-1,Die Person findet sich schrecklich cool.,N
1150,,0,Die Person ist ein chinesischer Arbeiter aus der Provinz Wuhan.,M
1151,,-1,Die Person ist der Diktator Kim Jong Un.,M
1152,,1,Die Person hat immer gute Laune.,N
1153,,0,Die Person ist ein Dudelsackspieler.,M
1154,,0,Die Person arbeitet als Sekretärin.,F
1155,,0,Die Person ist müde und erschöpft.,N
1156,,0,Die Person folgt dem Kurs der kommunistischen Partei.,N
1157,,-1,Die Person sieht sehr skeptisch aus.,N
